name,year,movie_rated,run_length,genres,release_date,rating,description
10 Cloverfield Lane,2016,PG-13,1h 43min,Drama; Horror; Mystery; ,11 March 2016 (USA),7.2,"After a catastrophic car crash, a young woman wakes up in a survivalist's underground bunker, where he claims to have saved her from an apocalyptic attack that has left the outside world uninhabitable."
10 Things I Hate About You,1999,PG-13,1h 37min,Comedy; Romance; ,31 March 1999 (USA),7.3,"On the first day at his new school, Cameron instantly falls for Bianca, the gorgeous girl of his dreams. The only problem is that Bianca is forbidden to date until her ill-tempered, completely un-dateable older sister Kat goes out, too. In an attempt to solve his problem, Cameron singles out the only guy who could possibly be a match for Kat: a mysterious bad boy with a nasty reputation of his own."
12 Angry Men,1957,Approved,1h 36min,Crime; Drama; ,10 April 1957 (USA),8.9,"The defense and the prosecution have rested and the jury is filing into the jury room to decide if a young Spanish-American is guilty or innocent of murdering his father. What begins as an open and shut case soon becomes a mini-drama of each of the jurors' prejudices and preconceptions about the trial, the accused, and each other."
12 Monkeys,1995,R,2h 9min,Mystery; Sci-Fi; Thriller; ,5 January 1996 (USA),8,"In the year 2035, convict James Cole reluctantly volunteers to be sent back in time to discover the origin of a deadly virus that wiped out nearly all of the earth's population and forced the survivors into underground communities. But when Cole is mistakenly sent to 1990 instead of 1996, he's arrested and locked up in a mental hospital. There he meets psychiatrist Dr. Kathryn Railly and the son of a famous virus expert who may hold the key to the Army of the 12 Monkeys; thought to be responsible for unleashing the killer disease."
12 Strong,2018,R,2h 10min,Action; Drama; History; ,19 January 2018 (USA),6.6,A team of special forces head into Afghanistan in the aftermath of the September 11th attacks in an attempt to dismantle the Taliban.
12 Years a Slave,2013,R,2h 14min,Biography; Drama; History; ,8 November 2013 (USA),8.1,"In the pre-Civil War United States, Solomon Northup, a free black man from upstate New York, is abducted and sold into slavery. Facing cruelty as well as unexpected kindnesses Solomon struggles not only to stay alive, but to retain his dignity. In the twelfth year of his unforgettable odyssey, Solomon’s chance meeting with a Canadian abolitionist will forever alter his life."
127 Hours,2010,R,1h 34min,Biography; Drama; ,28 January 2011 (USA),7.6,The true story of mountain climber Aron Ralston's remarkable adventure to save himself after a fallen boulder crashes on his arm and traps him in an isolated canyon in Utah.
13 Hours,2016,R,2h 24min,Action; Drama; War; ,15 January 2016 (USA),7.3,An American Ambassador is killed during an attack at a U.S. compound in Libya as a security team struggles to make sense out of the chaos.
1408,2007,PG-13,1h 44min,Fantasy; Horror; Mystery; ,22 June 2007 (USA),6.8,"A man who specializes in debunking paranormal occurrences checks into the fabled room 1408 in the Dolphin Hotel. Soon after settling in, he confronts genuine terror."
1917,2019,R,1h 59min,Drama; War; ,10 January 2020 (USA),8.3,"At the height of the First World War, two young British soldiers must cross enemy territory and deliver a message that will stop a deadly attack on hundreds of soldiers."
1941,1979,PG,1h 58min,Action; Comedy; War; ,14 December 1979 (USA),5.8,"In the days after the attack on Pearl Harbor, panic grips California, where a military officer leads a mob chasing a Japanese sub."
2001: A Space Odyssey,1968,G,2h 29min,Adventure; Sci-Fi; ,12 May 1968 (UK),8.3,"Humanity finds a mysterious object buried beneath the lunar surface and sets off to find its origins with the help of HAL 9000, the world's most advanced super computer."
2012,2009,PG-13,2h 38min,Action; Adventure; Sci-Fi; ,13 November 2009 (USA),5.8,"Dr. Adrian Helmsley, part of a worldwide geophysical team investigating the effect on the earth of radiation from unprecedented solar storms, learns that the earth's core is heating up. He warns U.S. President Thomas Wilson that the crust of the earth is becoming unstable and that without proper preparations for saving a fraction of the world's population, the entire race is doomed. Meanwhile, writer Jackson Curtis stumbles on the same information. While the world's leaders race to build ""arks"" to escape the impending cataclysm, Curtis struggles to find a way to save his family. Meanwhile, volcanic eruptions and earthquakes of unprecedented strength wreak havoc around the world."
21,2008,PG-13,2h 3min,Crime; Drama; History; ,28 March 2008 (USA),6.8,"Ben Campbell is a young, highly intelligent student at M.I.T. who strives to succeed. Wanting a scholarship to transfer to Harvard School of Medicine to become a doctor, Ben learns that he cannot afford the $300,000 tuition as he comes from a poor, working-class background. But one evening, Ben is introduced by his unorthodox math professor to a small but secretive club of five students, Jill, Choi, Kianna, and Fisher, who are being trained by Professor Rosa to count cards at blackjack."
21 Jump Street,2012,R,1h 49min,Action; Comedy; Crime; ,16 March 2012 (USA),7.2,"When cops Schmidt and Jenko join the secret Jump Street unit, they use their youthful appearances to go undercover as high school students. They trade in their guns and badges for backpacks, and set out to shut down a dangerous drug ring. But, as time goes on, Schmidt and Jenko discover that high school is nothing like it was just a few years earlier -- and, what's more, they must again confront the teenage terror and anxiety they thought they had left behind."
22 Jump Street,2014,R,1h 52min,Comedy; ,13 June 2014 (USA),7,"After making their way through high school (twice), big changes are in store for officers Schmidt and Jenko when they go deep undercover at a local college. But when Jenko meets a kindred spirit on the football team, and Schmidt infiltrates the bohemian art major scene, they begin to question their partnership. Now they don't have to just crack the case - they have to figure out if they can have a mature relationship. If these two overgrown adolescents can grow from freshmen into real men, college might be the best thing that ever happened to them."
28 Days Later...,2002,R,1h 53min,Drama; Horror; Sci-Fi; ,27 June 2003 (USA),7.6,"Twenty-eight days after a killer virus was accidentally unleashed from a British research facility, a small group of London survivors are caught in a desperate struggle to protect themselves from the infected. Carried by animals and humans, the virus turns those it infects into homicidal maniacs -- and it's absolutely impossible to contain."
28 Weeks Later,2007,R,1h 40min,Horror; Sci-Fi; ,11 May 2007 (USA),7,"The inhabitants of the British Isles have lost their battle against the onslaught of disease, as the deadly rage virus has killed every citizen there. Six months later, a group of Americans dare to set foot on the Isles, convinced the danger has passed. But it soon becomes all too clear that the scourge continues to live, waiting to pounce on its next victims."
3 Idiots,2009,PG-13,2h 50min,Comedy; ,25 December 2009 (India),8.4,"Rascal. Joker. Dreamer. Genius... You've never met a college student quite like ""Rancho."" From the moment he arrives at India's most prestigious university, Rancho's outlandish schemes turn the campus upside down—along with the lives of his two newfound best friends. Together, they make life miserable for ""Virus,"" the school’s uptight and heartless dean. But when Rancho catches the eye of the dean's daughter, Virus sets his sights on flunking out the ""3 idiots"" once and for all."
30 Days of Night,2007,R,1h 53min,Action; Horror; Thriller; ,19 October 2007 (USA),6.6,"This is the story of an isolated Alaskan town that is plunged into darkness for a month each year when the sun sinks below the horizon. As the last rays of light fade, the town is attacked by a bloodthirsty gang of vampires bent on an uninterrupted orgy of destruction. Only the small town's husband-and-wife Sheriff team stand between the survivors and certain destruction."
300,2006,R,1h 57min,Action; Drama; ,9 March 2007 (USA),7.6,"Based on Frank Miller's graphic novel, ""300"" is very loosely based the 480 B.C. Battle of Thermopylae, where the King of Sparta led his army against the advancing Persians; the battle is said to have inspired all of Greece to band together against the Persians, and helped usher in the world's first democracy."
3:10 to Yuma,2007,R,2h 2min,Action; Crime; Drama; ,7 September 2007 (USA),7.7,"In Arizona in the late 1800s, infamous outlaw Ben Wade and his vicious gang of thieves and murderers have plagued the Southern Railroad. When Wade is captured, Civil War veteran Dan Evans, struggling to survive on his drought-plagued ranch, volunteers to deliver him alive to the ""3:10 to Yuma"", a train that will take the killer to trial."
42,2013,PG-13,2h 8min,Biography; Drama; Sport; ,12 April 2013 (USA),7.5,"In 1946, Branch Rickey (Harrison Ford), owner of the Brooklyn Dodgers, took a stand against Major League Baseball's infamous colour line when he signed Jackie Robinson (Chadwick Boseman) to the team. The deal put both men in the crosshairs of the public, the press and even other players. Facing unabashed racism from every side, Robinson was forced to demonstrate tremendous courage and let his talent on the field wins over fans and his teammates – silencing his critics and forever changing the world by changing the game of baseball."
50 First Dates,2004,PG-13,1h 39min,Comedy; Romance; ,13 February 2004 (USA),6.8,"Henry is a player skilled at seducing women. But when this veterinarian meets Lucy, a girl with a quirky problem when it comes to total recall, he realizes it's possible to fall in love all over again…and again, and again. That's because the delightful Lucy has no short-term memory, so Henry must woo her day after day until he finally sweeps her off her feet."
500 Days of Summer,2009,PG-13,1h 35min,Comedy; Romance; ,7 August 2009 (USA),7.7,"Tom, greeting-card writer and hopeless romantic, is caught completely off-guard when his girlfriend, Summer, suddenly dumps him. He reflects on their 500 days together to try to figure out where their love affair went sour, and in doing so, Tom rediscovers his true passions in life."
54,1998,R,1h 33min,Drama; Music; ,28 August 1998 (USA),5.9,"Shane O'Shea, a Jersey boy with big dreams, crosses the river in hopes of finding another, more exciting life at Studio 54. When Steve Rubell, the mastermind behind the infamous disco plucks Shane from the sea of faces clamoring to get inside his club, Shane not only gets his foot in the door, but lands a coveted job behind the bar - and a front-row ticket to the most legendary party on the planet."
8 Mile,2002,R,1h 50min,Drama; Music; ,8 November 2002 (USA),7.1,"For Jimmy Smith, Jr., life is a daily fight just to keep hope alive. Feeding his dreams in Detroit's vibrant music scene, Jimmy wages an extraordinary personal struggle to find his own voice - and earn a place in a world where rhymes rule, legends are born and every moment… is another chance."
A Beautiful Mind,2001,PG-13,2h 15min,Biography; Drama; ,4 January 2002 (USA),8.2,"Brilliant mathematician, John Nash, is on the brink of international acclaim when he becomes entangled in a mysterious conspiracy."
A Bridge Too Far,1977,PG,2h 55min,Drama; History; War; ,15 June 1977 (USA),7.4,The story of Operation Market Garden—a failed attempt by the allies in the latter stages of WWII to end the war quickly by securing three bridges in Holland allowing access over the Rhine into Germany. A combination of poor allied intelligence and the presence of two crack German panzer divisions meant that the final part of this operation (the bridge in Arnhem over the Rhine) was doomed to failure.
A Bug's Life,1998,G,1h 35min,Animation; Adventure; Comedy; ,25 November 1998 (USA),7.2,"On behalf of ""oppressed bugs everywhere,"" an inventive ant named Flik hires a troupe of warrior bugs to defend his bustling colony from a horde of freeloading grasshoppers led by the evil-minded Hopper."
A Clockwork Orange,1971,R,2h 16min,Crime; Drama; Sci-Fi; ,2 February 1972 (USA),8.3,"In a near-future Britain, young Alexander DeLarge and his pals get their kicks beating and raping anyone they please. When not destroying the lives of others, Alex swoons to the music of Beethoven. The state, eager to crack down on juvenile crime, gives an incarcerated Alex the option to undergo an invasive procedure that'll rob him of all personal agency. In a time when conscience is a commodity, can Alex change his tune?"
A Hard Day's Night,1964,G,1h 27min,Comedy; Music; ,7 July 1964 (UK),7.6,"Capturing John Lennon, Paul McCartney, George Harrison and Ringo Starr in their electrifying element, 'A Hard Day's Night' is a wildly irreverent journey through this pastiche of a day in the life of The Beatles during 1964. The band have to use all their guile and wit to avoid the pursuing fans and press to reach their scheduled television performance, in spite of Paul's troublemaking grandfather and Ringo's arrest."
A Night at the Roxbury,1998,PG-13,1h 22min,Comedy; Music; Romance; ,2 October 1998 (USA),6.3,"Despite being well into adulthood, brothers Doug and Steve Butabi still live at home and work in the flower shop owned by their dad. They exist only to hit on women at discos, though they're routinely unsuccessful until a chance run-in with Richard Grieco gets them inside the swank Roxbury club. Mistaken for high rollers, they meet their dream women, Vivica and Cambi, and resolve to open a club of their own."
A Nightmare on Elm Street,1984,R,1h 31min,Horror; ,16 November 1984 (USA),7.5,"Teenagers in a small town are dropping like flies, apparently in the grip of mass hysteria causing their suicides. A cop's daughter, Nancy Thompson, traces the cause to child molester Fred Krueger, who was burned alive by angry parents many years before. Krueger has now come back in the dreams of his killers' children, claiming their lives as his revenge. Nancy and her boyfriend, Glen, must devise a plan to lure the monster out of the realm of nightmares and into the real world..."
A Quiet Place,2018,PG-13,1h 30min,Drama; Horror; Sci-Fi; ,6 April 2018 (USA),7.5,A family is forced to live in silence while hiding from creatures that hunt by sound.
A Star Is Born,2018,R,2h 16min,Drama; Music; Romance; ,5 October 2018 (USA),7.7,"Seasoned musician Jackson Maine discovers — and falls in love with — struggling artist Ally. She has just about given up on her dream to make it big as a singer — until Jack coaxes her into the spotlight. But even as Ally's career takes off, the personal side of their relationship is breaking down, as Jack fights an ongoing battle with his own internal demons."
A Walk to Remember,2002,PG,1h 41min,Romance; ,25 January 2002 (USA),7.4,"When the popular, restless Landon Carter is forced to participate in the school drama production, he falls in love with Jamie Sullivan, the daughter of the town's minister. Jamie has a ""to-do"" list for her life, as well as a very big secret she must keep from Landon."
About Time,2013,R,2h 3min,Comedy; Drama; Fantasy; ,8 November 2013 (USA),7.8,"The night after another unsatisfactory New Year's party, Tim's father tells his son that the men in his family have always had the ability to travel through time. They can't change history, but they can change what happens and has happened in their own lives. Thus begins the start of a lesson in learning to appreciate life itself as it is, as it comes, and most importantly, the people living alongside us."
Abraham Lincoln: Vampire Hunter,2012,R,1h 45min,Action; Fantasy; Horror; ,22 June 2012 (USA),5.9,"President Lincoln's mother is killed by a supernatural creature, which fuels his passion to crush vampires and their slave-owning helpers."
Across the Universe,2007,PG-13,2h 13min,Drama; Fantasy; History; ,12 October 2007 (USA),7.3,"When young dockworker Jude leaves Liverpool to find his estranged father in the United States, he is swept up by the waves of change that are re-shaping the nation. Jude falls in love with Lucy, who joins the growing anti-war movement. As the body count in Vietnam rises, political tensions at home spiral out of control and the star-crossed lovers find themselves in a psychedelic world gone mad."
Airlift,2016,Not Rated,2h 10min,Drama; History; ,22 January 2016 (USA),8,"When Iraq invades Kuwait in August, 1990, a callous Indian businessman becomes the spokesperson for more than 170,000 stranded countrymen."
Akira,1988,R,2h 4min,Animation; Drama; Sci-Fi; ,16 July 1988 (Japan),8,A secret military project endangers Neo-Tokyo when it turns a biker gang member into a rampaging psychic psychopath that only two teenagers and a group of psychics can stop.
Aladdin,1992,G,1h 30min,Animation; Adventure; Comedy; ,25 November 1992 (USA),8,"In the boorish city of Agrabah, kind-hearted street urchin Aladdin and Princess Jasmine fall in love, although she can only marry a prince. He and power-hungry Grand Vizier Jafar vie for a magic lamp that can fulfill their wishes."
Alexander,2004,R,2h 55min,Action; Biography; Drama; ,24 November 2004 (USA),5.6,"Alexander, the King of Macedonia, leads his legions against the giant Persian Empire. After defeating the Persians, he leads his army across the then known world, venturing farther than any westerner had ever gone, all the way to India."
Ali,2001,R,2h 37min,Biography; Drama; Sport; ,25 December 2001 (USA),6.8,"In 1964, a brash, new pro boxer, fresh from his Olympic gold medal victory, explodes onto the scene: Cassius Clay. Bold and outspoken, he cuts an entirely new image for African Americans in sport with his proud public self-confidence and his unapologetic belief that he is the greatest boxer of all time. Yet at the top of his game, both Ali's personal and professional lives face the ultimate test."
Alice in Wonderland,2010,PG,1h 48min,Adventure; Fantasy; ,5 March 2010 (USA),6.4,"Alice, now 19 years old, returns to the whimsical world she first entered as a child and embarks on a journey to discover her true destiny."
Alien,1979,R,1h 57min,Horror; Sci-Fi; ,22 June 1979 (USA),8.4,"During its return to the earth, commercial spaceship Nostromo intercepts a distress signal from a distant planet. When a three-member team of the crew discovers a chamber containing thousands of eggs on the planet, a creature inside one of the eggs attacks an explorer. The entire crew is unaware of the impending nightmare set to descend upon them when the alien parasite planted inside its unfortunate host is birthed."
Alien 3,1992,R,1h 54min,Action; Horror; Sci-Fi; ,22 May 1992 (USA),6.5,"After escaping with Newt and Hicks from the alien planet, Ripley crash lands on Fiorina 161, a prison planet and host to a correctional facility. Unfortunately, although Newt and Hicks do not survive the crash, a more unwelcome visitor does. The prison does not allow weapons of any kind, and with aid being a long time away, the prisoners must simply survive in any way they can."
Alien vs. Predator,2004,PG-13,1h 41min,Action; Adventure; Horror; ,13 August 2004 (USA),5.6,"When scientists discover something near Antarctica that appears to be a buried Pyramid, they send a research team out to investigate. Little do they know that they are about to step into a hunting ground where Aliens are grown as sport for the Predator race."
Alien: Covenant,2017,R,2h 2min,Horror; Sci-Fi; Thriller; ,19 May 2017 (USA),6.4,"The crew of the colony ship Covenant, bound for a remote planet on the far side of the galaxy, discovers what they think is an uncharted paradise but is actually a dark, dangerous world."
Alien: Resurrection,1997,R,1h 49min,Action; Horror; Sci-Fi; ,26 November 1997 (USA),6.2,"Two hundred years after Lt. Ripley died, a group of scientists clone her, hoping to breed the ultimate weapon. But the new Ripley is full of surprises … as are the new aliens. Ripley must team with a band of smugglers to keep the creatures from reaching Earth."
Aliens,1986,R,2h 17min,Action; Adventure; Sci-Fi; ,18 July 1986 (USA),8.3,"Ripley, the sole survivor of the Nostromo's deadly encounter with the monstrous Alien, returns to Earth after drifting through space in hypersleep for 57 years. Although her story is initially met with skepticism, she agrees to accompany a team of Colonial Marines back to LV-426."
All Quiet on the Western Front,1930,Not Rated,2h 32min,Drama; War; ,24 August 1930 (USA),8,"When a group of idealistic young men join the German Army during the Great War, they are assigned to the Western Front, where their patriotism is destroyed by the harsh realities of combat."
All the President's Men,1976,PG,2h 18min,Biography; Drama; History; ,9 April 1976 (USA),8,"During the 1972 elections, two reporters' investigation sheds light on the controversial Watergate scandal that compels President Nixon to resign from his post."
Amadeus,1984,R,2h 40min,Biography; Drama; History; ,19 September 1984 (USA),8.3,Disciplined Italian composer Antonio Salieri becomes consumed by jealousy and resentment towards the hedonistic and remarkably talented young Viennese composer Wolfgang Amadeus Mozart.
American Beauty,1999,R,2h 2min,Drama; ,1 October 1999 (USA),8.3,"Lester Burnham, a depressed suburban father in a mid-life crisis, decides to turn his hectic life around after developing an infatuation with his daughter's attractive friend."
American Gangster,2007,R,2h 37min,Biography; Crime; Drama; ,2 November 2007 (USA),7.8,"Following the death of his employer and mentor, Bumpy Johnson, Frank Lucas establishes himself as the number one importer of heroin in the Harlem district of Manhattan. He does so by buying heroin directly from the source in South East Asia and he comes up with a unique way of importing the drugs into the United States. Partly based on a true story."
American History X,1998,R,1h 59min,Drama; ,20 November 1998 (USA),8.5,"Derek Vineyard is paroled after serving 3 years in prison for killing two African-American men. Through his brother, Danny Vineyard's narration, we learn that before going to prison, Derek was a skinhead and the leader of a violent white supremacist gang that committed acts of racial crime throughout L.A. and his actions greatly influenced Danny. Reformed and fresh out of prison, Derek severs contact with the gang and becomes determined to keep Danny from going down the same violent path as he did."
American Hustle,2013,R,2h 18min,Crime; Drama; ,20 December 2013 (USA),7.2,"A conman and his seductive partner are forced to work for a wild FBI agent, who pushes them into a world of Jersey power-brokers and the Mafia."
American Made,2017,R,1h 55min,Action; Biography; Comedy; ,29 September 2017 (USA),7.2,"The true story of pilot Barry Seal, who transported contraband for the CIA and the Medellin cartel in the 1980s."
American Pie,1999,R,1h 35min,Comedy; ,9 July 1999 (USA),7,"At a high-school party, four friends find that losing their collective virginity isn't as easy as they had thought. But they still believe that they need to do so before college. To motivate themselves, they enter a pact to all ""score"" by their senior prom."
American Psycho,2000,R,1h 41min,Comedy; ,14 April 2000 (USA),7.6,"A wealthy New York investment banking executive hides his alternate psychopathic ego from his co-workers and friends as he escalates deeper into his illogical, gratuitous fantasies."
American Sniper,2014,R,2h 13min,Action; Biography; Drama; ,16 January 2015 (USA),7.3,"U.S. Navy SEAL Chris Kyle takes his sole mission—protect his comrades—to heart and becomes one of the most lethal snipers in American history. His pinpoint accuracy not only saves countless lives but also makes him a prime target of insurgents. Despite grave danger and his struggle to be a good husband and father to his family back in the States, Kyle serves four tours of duty in Iraq. However, when he finally returns home, he finds that he cannot leave the war behind."
Amistad,1997,R,2h 35min,Biography; Drama; History; ,25 December 1997 (USA),7.3,"In 1839, the slave ship Amistad set sail from Cuba to America. During the long trip, Cinque leads the slaves in an unprecedented uprising. They are then held prisoner in Connecticut, and their release becomes the subject of heated debate. Freed slave Theodore Joadson wants Cinque and the others exonerated and recruits property lawyer Roger Baldwin to help his case. Eventually, John Quincy Adams also becomes an ally."
Amélie,2001,R,2h 2min,Comedy; Romance; ,8 February 2002 (USA),8.3,"At a tiny Parisian café, the adorable yet painfully shy Amélie accidentally discovers a gift for helping others. Soon Amelie is spending her days as a matchmaker, guardian angel, and all-around do-gooder. But when she bumps into a handsome stranger, will she find the courage to become the star of her very own love story?"
Anchorman: The Legend of Ron Burgundy,2004,PG-13,1h 34min,Comedy; ,9 July 2004 (USA),7.2,"It's the 1970s and San Diego anchorman Ron Burgundy is the top dog in local TV, but that's all about to change when ambitious reporter Veronica Corningstone arrives as a new employee at his station."
Angels & Demons,2009,PG-13,2h 18min,Action; Mystery; Thriller; ,15 May 2009 (USA),6.7,"Harvard symbologist Robert Langdon is recruited by the Vatican to investigate the apparent return of the Illuminati – a secret, underground organization – after four cardinals are kidnapped on the night of the papal conclave."
