name,year,movie_rated,run_length,genres,release_date,rating,description
Molly's Game,2017,R,2h 20min,Biography; Crime; Drama; ,5 January 2018 (USA),7.4,"Molly Bloom, a young skier and former Olympic hopeful becomes a successful entrepreneur (and a target of an FBI investigation) when she establishes a high-stakes, international poker game."
Moneyball,2011,PG-13,2h 13min,Biography; Drama; Sport; ,23 September 2011 (USA),7.6,"The story of Oakland Athletics general manager Billy Beane's successful attempt to put together a baseball team on a budget, by employing computer-generated analysis to draft his players."
Monster,2003,R,1h 49min,Biography; Crime; Drama; ,30 January 2004 (USA),7.3,"An emotionally scarred highway drifter shoots a sadistic trick who rapes her, and ultimately becomes America's first female serial killer."
Monsters University,2013,G,1h 44min,Animation; Adventure; Comedy; ,21 June 2013 (USA),7.3,A look at the relationship between Mike and Sulley during their days at Monsters University — when they weren't necessarily the best of friends.
Monsters vs. Aliens,2009,PG,1h 34min,Animation; Action; Adventure; ,27 March 2009 (USA),6.4,"When Susan Murphy is unwittingly clobbered by a meteor full of outer space gunk on her wedding day, she mysteriously grows to 49-feet-11-inches. The military jumps into action and captures Susan, secreting her away to a covert government compound. She is renamed Ginormica and placed in confinement with a ragtag group of Monsters..."
"Monsters, Inc.",2001,G,1h 32min,Animation; Adventure; Comedy; ,2 November 2001 (USA),8,"Lovable Sulley and his wisecracking sidekick Mike Wazowski are the top scare team at Monsters, Inc., the scream-processing factory in Monstropolis. When a little girl named Boo wanders into their world, it's the monsters who are scared silly, and it's up to Sulley and Mike to keep her out of sight and get her back home."
Monty Python and the Holy Grail,1975,PG,1h 31min,Comedy; ,6 December 1979 (India),8.2,"King Arthur, accompanied by his squire, recruits his Knights of the Round Table, including Sir Bedevere the Wise, Sir Lancelot the Brave, Sir Robin the Not-Quite-So-Brave-As-Sir-Lancelot and Sir Galahad the Pure. On the way, Arthur battles the Black Knight who, despite having had all his limbs chopped off, insists he can still fight. They reach Camelot, but Arthur decides not  to enter, as ""it is a silly place""."
Monty Python's Life of Brian,1979,R,1h 34min,Comedy; ,17 August 1979 (USA),8.1,"Brian Cohen is an average young Jewish man, but through a series of ridiculous events, he gains a reputation as the Messiah. When he's not dodging his followers or being scolded by his shrill mother, the hapless Brian has to contend with the pompous Pontius Pilate and acronym-obsessed members of a separatist movement. Rife with Monty Python's signature absurdity, the tale finds Brian's life paralleling Biblical lore, albeit with many more laughs."
Moon,2009,R,1h 37min,Drama; Mystery; Sci-Fi; ,10 July 2009 (USA),7.9,"With only three weeks left in his three-year contract, Sam Bell is getting anxious to finally return to Earth. He is the only occupant of a Moon-based manufacturing facility along with his computer and assistant, GERTY. When he has an accident however, he awakens to find that he is not alone."
Moonrise Kingdom,2012,PG-13,1h 34min,Comedy; Romance; ,29 June 2012 (USA),7.8,"Set on an island off the coast of New England in the summer of 1965, Moonrise Kingdom tells the story of two twelve-year-olds who fall in love, make a secret pact, and run away together into the wilderness. As various authorities try to hunt them down, a violent storm is brewing off-shore – and the peaceful island community is turned upside down in more ways than anyone can handle."
Mother!,2017,R,2h 1min,Drama; Horror; Mystery; ,15 September 2017 (USA),6.6,"A couple's relationship is tested when uninvited guests arrive at their home, disrupting their tranquil existence."
Moulin Rouge!,2001,PG-13,2h 7min,Romance; ,1 June 2001 (USA),7.6,"A celebration of love and creative inspiration takes place in the infamous, gaudy and glamorous Parisian nightclub, at the cusp of the 20th century. A young poet, who is plunged into the heady world of Moulin Rouge, begins a passionate affair with the club's most notorious and beautiful star."
Mr. & Mrs. Smith,2005,PG-13,2h,Comedy; ,10 June 2005 (USA),6.5,"After five (or six) years of vanilla-wedded bliss, ordinary suburbanites John and Jane Smith are stuck in a huge rut. Unbeknownst to each other, they are both coolly lethal, highly-paid assassins working for rival organisations. When they discover they're each other's next target, their secret lives collide in a spicy, explosive mix of wicked comedy, pent-up passion, nonstop action and high-tech weaponry."
Mr. Holland's Opus,1995,PG,2h 23min,Drama; Music; ,19 January 1996 (USA),7.3,"In 1965, passionate musician Glenn Holland takes a day job as a high school music teacher, convinced it's just a small obstacle on the road to his true calling: writing a historic opus. As the decades roll by with the composition unwritten but generations of students inspired through his teaching, Holland must redefine his life's purpose."
Mr. Nobody,2009,R,2h 21min,Drama; Fantasy; Romance; ,26 September 2013 (USA),7.8,"Nemo Nobody leads an ordinary existence with his wife and 3 children; one day, he wakes up as a mortal centenarian in the year 2092."
Mudbound,2017,R,2h 14min,Drama; War; ,17 November 2017 (USA),7.4,"In the post–World War II South, two families are pitted against a barbaric social hierarchy and an unrelenting landscape as they simultaneously fight the battle at home and the battle abroad."
Mulan,1998,G,1h 28min,Animation; Adventure; ,19 June 1998 (USA),7.6,"To save her father from certain death in the army, a young woman secretly enlists in his place and becomes one of China's greatest heroines in the process."
Mulholland Drive,2001,R,2h 27min,Drama; Mystery; Thriller; ,19 October 2001 (USA),8,"Blonde Betty Elms has only just arrived in Hollywood to become a movie star when she meets an enigmatic brunette with amnesia. Meanwhile, as the two set off to solve the second woman's identity, filmmaker Adam Kesher runs into ominous trouble while casting his latest project."
Munich,2005,R,2h 44min,Action; Drama; History; ,6 January 2006 (USA),7.5,"During the 1972 Olympic Games in Munich, eleven Israeli athletes are taken hostage and murdered by a Palestinian terrorist group known as Black September. In retaliation, the Israeli government recruits a group of Mossad agents to track down and execute those responsible for the attack."
Murder on the Orient Express,2017,PG-13,1h 54min,Crime; Drama; Mystery; ,10 November 2017 (USA),6.5,Genius Belgian detective Hercule Poirot investigates the murder of an American tycoon aboard the Orient Express train.
Music and Lyrics,2007,PG-13,1h 44min,Comedy; Music; Romance; ,14 February 2007 (USA),6.5,"A washed-up '80s pop star gets a chance at a comeback when reigning pop diva Cora Corman invites him to write & record a duet with her, but there's a problem--Alex hasn't written a song in years; he's never written lyrics and he has to come up with a hit in a matter of days."
My Neighbor Totoro,1988,G,1h 26min,Animation; Fantasy; ,13 July 1990 (USA),8.2,"Two sisters move to the country with their father in order to be closer to their hospitalized mother, and discover the surrounding trees are inhabited by Totoros, magical spirits of the forest. When the youngest runs away from home, the older sister seeks help from the spirits to find her."
Mystic River,2003,R,2h 18min,Crime; Drama; Mystery; ,15 October 2003 (USA),7.9,The lives of three men who were childhood friends are shattered when one of them suffers a family tragedy.
Nacho Libre,2006,PG,1h 32min,Comedy; Sport; ,16 June 2006 (USA),5.7,"Nacho Libre is loosely based on the story of Fray Tormenta (""Friar Storm""), aka Rev. Sergio Gutierrez Benitez, a real-life Mexican Catholic priest who had a 23-year career as a masked luchador. He competed in order to support the orphanage he directed."
National Treasure,2004,PG,2h 11min,Action; Adventure; Mystery; ,19 November 2004 (USA),6.9,"Modern treasure hunters, led by archaeologist Ben Gates, search for a chest of riches rumored to have been stashed away by George Washington, Thomas Jefferson and Benjamin Franklin during the Revolutionary War. The chest's whereabouts may lie in secret clues embedded in the Constitution and the Declaration of Independence, and Gates is in a race to find the gold before his enemies do."
National Treasure: Book of Secrets,2007,PG,2h 4min,Action; Adventure; Mystery; ,21 December 2007 (USA),6.5,"Benjamin Franklin Gates and Abigail Chase re-team with Riley Poole and, now armed with a stack of long-lost pages from John Wilkes Booth's diary, Ben must follow a clue left there to prove his ancestor's innocence in the assassination of Abraham Lincoln."
Nausicaä of the Valley of the Wind,1984,PG,1h 57min,Animation; Adventure; Fantasy; ,25 November 1987 (USA),8.1,"After a global war, the seaside kingdom known as the Valley of the Wind remains one of the last strongholds on Earth untouched by a poisonous jungle and the powerful insects that guard it. Led by the courageous Princess Nausicaä, the people of the Valley engage in an epic struggle to restore the bond between humanity and Earth."
Never Back Down,2008,PG-13,1h 53min,Action; Drama; Sport; ,14 March 2008 (USA),6.6,"Jake, full of anger after his father's death, is just starting to find a place for himself at his new Orlando high school - until Ryan, head of an underground MMA fight club, picks Jake out as a prime opponent. After being trounced by Ryan in front of the entire school, Jake begins training under the firm, moral guidance of a MMA master, where he learns how to fight... and how to avoid a fight. But it becomes obvious that a rematch will be inevitable if Jake wants to stop Ryan and his bullying, once and for all."
Nick and Norah's Infinite Playlist,2008,PG-13,1h 30min,Comedy; Drama; Music; ,3 October 2008 (USA),6.6,"Nick cannot stop obsessing over his ex-girlfriend, Tris, until Tris' friend Norah suddenly shows interest in him at a club. Thus begins an odd night filled with ups and downs as the two keep running into Tris and her new boyfriend while searching for Norah's drunken friend, Caroline, with help from Nick's band mates. As the night winds down, the two have to figure out what they want from each other."
Nightcrawler,2014,R,1h 57min,Crime; Drama; Thriller; ,31 October 2014 (USA),7.9,"When Lou Bloom, desperate for work, muscles into the world of L.A. crime journalism, he blurs the line between observer and participant to become the star of his own story. Aiding him in his effort is Nina, a TV-news veteran."
No Country for Old Men,2007,R,2h 2min,Crime; Drama; Thriller; ,21 November 2007 (USA),8.1,"Llewelyn Moss stumbles upon dead bodies, $2 million and a hoard of heroin in a Texas desert, but methodical killer Anton Chigurh comes looking for it, with local sheriff Ed Tom Bell hot on his trail. The roles of prey and predator blur as the violent pursuit of money and justice collide."
No Man's Land,2001,R,1h 38min,Comedy; Drama; War; ,19 September 2001 (France),7.9,"Two soldiers from opposite sites get stuck between the front lines in the same trench. The UN is asked to free them and both sides agree on a ceasefire, but will they stick to it?"
No Strings Attached,2011,R,1h 48min,Comedy; Romance; ,21 January 2011 (USA),6.2,"Emma is a busy doctor who sets up a seemingly perfect arrangement when she offers her best friend Adam a relationship with one rule: No strings attached. But when a fling becomes a thing, can sex friends stay best friends?"
Non-Stop,2014,PG-13,1h 46min,Action; Mystery; Thriller; ,28 February 2014 (USA),6.9,"Bill Marks is a Federal Air Marshall for whom every day is the same until this one. On this plane ride, he starts receiving text messages from someone claiming to be on the flight and threatening to kill passengers. In a race against the clock, he must identify and stop the killer to save everyone on board."
North by Northwest,1959,Approved,2h 16min,Adventure; Mystery; Thriller; ,26 September 1959 (Japan),8.3,"Advertising man Roger Thornhill is mistaken for a spy, triggering a deadly cross-country chase."
Notting Hill,1999,PG-13,2h 4min,Comedy; Romance; ,28 May 1999 (USA),7.1,"William Thacker is a London bookstore owner whose humdrum existence is thrown into romantic turmoil when famous American actress Anna Scott appears in his shop. A chance encounter over spilled orange juice leads to a kiss that blossoms into a full-blown affair. As the average bloke and glamorous movie star draw closer and closer together, they struggle to reconcile their radically different lifestyles in the name of love."
Now You See Me,2013,PG-13,1h 55min,Crime; Mystery; Thriller; ,31 May 2013 (USA),7.3,An FBI agent and an Interpol detective track a team of illusionists who pull off bank heists during their performances and reward their audiences with the money.
"O Brother, Where Art Thou?",2000,PG-13,1h 47min,Adventure; Comedy; Crime; ,2 February 2001 (USA),7.7,"In the deep south during the 1930s, three escaped convicts search for hidden treasure while a relentless lawman pursues them. On their journey they come across many comical characters and incredible situations. Based upon Homer's 'Odyssey'."
Oblivion,2013,PG-13,2h 4min,Action; Adventure; Sci-Fi; ,19 April 2013 (USA),7,"Jack Harper is one of the last few drone repairmen stationed on Earth. Part of a massive operation to extract vital resources after decades of war with a terrifying threat known as the Scavs, Jack’s mission is nearly complete. His existence is brought crashing down when he rescues a beautiful  stranger from a downed spacecraft. Her arrival triggers a chain of events that  forces him to question everything he knows and puts the fate of humanity in his hands."
Ocean's Eleven,2001,PG-13,1h 56min,Crime; Thriller; ,7 December 2001 (USA),7.7,"Less than 24 hours into his parole, charismatic thief Danny Ocean is already rolling out his next plan: In one night, Danny's hand-picked crew of specialists will attempt to steal more than $150 million from three Las Vegas casinos. But to score the cash, Danny risks his chances of reconciling with ex-wife, Tess."
Ocean's Thirteen,2007,PG-13,2h 2min,Action; Crime; Thriller; ,8 June 2007 (USA),6.9,"Danny Ocean's team of criminals are back and composing a plan more personal than ever. When ruthless casino owner Willy Bank doublecrosses Reuben Tishkoff, causing a heart attack, Danny Ocean vows that he and his team will do anything to bring down Willy Bank along with everything he's got. Even if it means asking for help from an enemy."
Ocean's Twelve,2004,PG-13,2h 5min,Crime; Thriller; ,10 December 2004 (USA),6.5,"Danny Ocean reunites with his old flame and the rest of his merry band of thieves in carrying out three huge heists in Rome, Paris and Amsterdam – but a Europol agent is hot on their heels."
Oldboy,2003,R,1h 41min,Action; Drama; Mystery; ,21 November 2003 (South Korea),8.4,"With no clue how he came to be imprisoned, drugged and tortured for 15 years, a desperate man seeks revenge on his captors."
Once,2007,R,1h 26min,Drama; Music; Romance; ,15 June 2007 (USA),7.8,"A vacuum repairman moonlights as a street musician and hopes for his big break. One day a Czech immigrant, who earns a living selling flowers, approaches him with the news that she is also an aspiring singer-songwriter. The pair decide to collaborate, and the songs that they compose reflect the story of their blossoming love."
Once Upon a Time in America,1984,R,3h 49min,Crime; Drama; ,1 June 1984 (USA),8.4,"A former Prohibition-era Jewish gangster returns to the Lower East Side of Manhattan over thirty years later, where he once again must confront the ghosts and regrets of his old life."
Once Upon a Time... in Hollywood,2019,R,2h 41min,Comedy; ,26 July 2019 (USA),7.7,"Los Angeles, 1969. TV star Rick Dalton, a struggling actor specializing in westerns, and stuntman Cliff Booth, his best friend, try to survive in a constantly changing movie industry. Dalton is the neighbor of the young and promising actress and model Sharon Tate, who has just married the prestigious Polish director Roman Polanski…"
One Flew Over the Cuckoo's Nest,1975,R,2h 13min,Drama; ,19 November 1975 (USA),8.7,"A petty criminal fakes insanity to serve his sentence in a mental ward rather than prison. He soon finds himself as a leader to the other patients—and an enemy to the cruel, domineering nurse who runs the ward."
One Hundred and One Dalmatians,1961,G,1h 19min,Animation; Adventure; Comedy; ,25 January 1961 (USA),7.2,"When a litter of dalmatian puppies are abducted by the minions of Cruella De Vil, the parents must find them before she uses them for a diabolical fashion statement. In a Disney animation classic, Dalmatian Pongo is tired of his bachelor-dog life. He spies lovely Perdita and maneuvers his master, Roger, into meeting Perdita's owner, Anita. The owners fall in love and marry, keeping Pongo and Perdita together too. After Perdita gives birth to a litter of 15 puppies, Anita's old school friend Cruella De Vil wants to buy them all. Roger declines her offer, so Cruella hires the criminal Badun brothers to steal them -- so she can have a fur coat."
Orphan,2009,R,2h 3min,Horror; Mystery; Thriller; ,24 July 2009 (USA),6.9,"After losing their baby, a married couple adopt 9-year old Esther, who may not be as innocent as she seems."
Over the Hedge,2006,PG,1h 23min,Animation; Adventure; Comedy; ,19 May 2006 (USA),6.7,"A scheming raccoon fools a mismatched family of forest creatures into helping him repay a debt of food, by invading the new suburban sprawl that popped up while they were hibernating – and learns a lesson about family himself."
Over the Top,1987,PG,1h 33min,Action; Drama; Sport; ,13 February 1987 (USA),5.8,"Sylvester Stallone stars as hard-luck big-rig trucker Lincoln Hawk and takes us under the glaring Las Vegas lights for all the boisterous action of the World Armwrestling Championship.  Relying on wits and willpower, Hawk tries to rebuild his life by capturing the first-place prize money, and the love of the son he abandoned years earlier into the keeping of his rich, ruthless father-in-law."
P.S. I Love You,2007,PG-13,2h 6min,Comedy; Romance; ,21 December 2007 (USA),7,A young widow discovers that her late husband has left her 10 messages intended to help ease her pain and start a new life.
Pacific Rim,2013,PG-13,2h 11min,Action; Adventure; Sci-Fi; ,12 July 2013 (USA),6.9,"Using massive piloted robots to combat the alien threat, earth's survivors take the fight to the invading alien force lurking in the depths of the Pacific Ocean. Nearly defenseless in the face of the relentless enemy, the forces of mankind have no choice but to turn to two unlikely heroes who now stand as earth's final hope against the mounting apocalypse."
Pan's Labyrinth,2006,R,1h 58min,Drama; Fantasy; War; ,19 January 2007 (USA),8.2,"Living with her tyrannical stepfather in a new home with her pregnant mother, 10-year-old Ofelia feels alone until she explores a decaying labyrinth guarded by a mysterious faun who claims to know her destiny. If she wishes to return to her real father, Ofelia must complete three terrifying tasks."
Paranormal Activity,2007,R,1h 26min,Horror; Mystery; Thriller; ,16 October 2009 (USA),6.3,"After a young, middle-class couple moves into what seems like a typical suburban house, they become increasingly disturbed by a presence that may or may not be demonic but is certainly the most active in the middle of the night."
Parasite,2019,R,2h 12min,Comedy; ,8 November 2019 (USA),8.6,"All unemployed, Ki-taek's family takes peculiar interest in the wealthy and glamorous Parks for their livelihood until they get entangled in an unexpected incident."
Passengers,2016,PG-13,1h 56min,Romance; ,21 December 2016 (USA),7,"A spacecraft traveling to a distant colony planet and transporting thousands of people has a malfunction in its sleep chambers. As a result, two passengers are awakened 90 years early."
Paths of Glory,1957,Approved,1h 28min,Drama; War; ,25 December 1957 (USA),8.4,A commanding officer defends three scapegoats on trial for a failed offensive that occurred within the French Army in 1916.
Patton,1970,GP,2h 52min,Biography; Drama; War; ,2 April 1970 (USA),7.9,"""Patton"" tells the tale of General George S. Patton, famous tank commander of World War II. The film begins with Patton's career in North Africa and progresses through the invasion of Germany and the fall of the Third Reich. Side plots also speak of Patton's numerous faults such his temper and habit towards insubordination."
Pawn Sacrifice,2014,PG-13,1h 55min,Biography; Drama; Sport; ,25 September 2015 (USA),7,American chess champion Bobby Fischer prepares for a legendary match-up against Russian Boris Spassky.
Peaceful Warrior,2006,PG-13,2h,Drama; Romance; Sport; ,23 June 2006 (USA),7.3,A chance encounter with a stranger changes the life of a college gymnast.
Pearl Harbor,2001,PG-13,3h 3min,Action; Drama; History; ,25 May 2001 (USA),6.2,"The lifelong friendship between Rafe McCawley and Danny Walker is put to the ultimate test when the two ace fighter pilots become entangled in a love triangle with beautiful Naval nurse Evelyn Johnson. But the rivalry between the friends-turned-foes is immediately put on hold when they find themselves at the center of Japan's devastating attack on Pearl Harbor on Dec. 7, 1941."
Pi,1998,R,1h 24min,Drama; Horror; Mystery; ,10 July 1998 (USA),7.4,"A mathematical genius discovers a link between numbers and reality, and thus believes he can predict the future."
Pineapple Express,2008,R,1h 51min,Action; Comedy; Crime; ,6 August 2008 (USA),6.9,A stoner and his dealer are forced to go on the run from the police after the pothead witnesses a cop commit a murder.
Pirate Radio,2009,R,1h 57min,Comedy; Drama; Music; ,13 November 2009 (USA),7.4,"Tape Crackers' is a vital documentary focussed on one guy, Michael Finch, and his amazing tape collection of pirate radio recordings made in the mid-late '90s."
Pirates of the Caribbean: At World's End,2007,PG-13,2h 49min,Action; Adventure; Fantasy; ,25 May 2007 (USA),7.1,"Will Turner and Elizabeth Swann join forces with the revived Captain Barbossa to free Jack Sparrow from Davy Jones' locker. The group must navigate dangerous waters, confront many foes and, ultimately, choose sides in a battle wherein piracy itself hangs in the balance."
Pirates of the Caribbean: Dead Man's Chest,2006,PG-13,2h 31min,Action; Adventure; Fantasy; ,7 July 2006 (USA),7.3,"Captain Jack Sparrow races to recover the heart of Davy Jones to avoid enslaving his soul to Jones' service, as other friends and foes seek the heart for their own agenda as well."
Pirates of the Caribbean: Dead Men Tell No Tales,2017,PG-13,2h 9min,Action; Adventure; Fantasy; ,26 May 2017 (USA),6.6,"Thrust into an all-new adventure, a down-on-his-luck Capt. Jack Sparrow feels the winds of ill-fortune blowing even more strongly when deadly ghost sailors led by his old nemesis, the evil Capt. Salazar, escape from the Devil's Triangle. Jack's only hope of survival lies in seeking out the legendary Trident of Poseidon, but to find it, he must forge an uneasy alliance with a brilliant and beautiful astronomer and a headstrong young man in the British navy."
Pirates of the Caribbean: On Stranger Tides,2011,PG-13,2h 16min,Action; Adventure; Fantasy; ,20 May 2011 (USA),6.6,"Captain Jack Sparrow crosses paths with a woman from his past, and he's not sure if it's love — or if she's a ruthless con artist who's using him to find the fabled Fountain of Youth. When she forces him aboard the Queen Anne's Revenge, the ship of the formidable pirate Blackbeard, Jack finds himself on an unexpected adventure in which he doesn't know who to fear more: Blackbeard or the woman from his past."
Pirates of the Caribbean: The Curse of the Black Pearl,2003,PG-13,2h 23min,Action; Adventure; Fantasy; ,9 July 2003 (USA),8,"After Port Royal is attacked and pillaged by a mysterious pirate crew, capturing the governor's daughter Elizabeth Swann in the process, William Turner asks free-willing pirate Jack Sparrow to help him locate the crew's ship—The Black Pearl—so that he can rescue the woman he loves."
Pitch Black,2000,R,1h 49min,Action; Horror; Sci-Fi; ,18 February 2000 (USA),7.1,"When their ship crash-lands on a remote planet, the marooned passengers soon learn that escaped convict Riddick isn't the only thing they have to fear. Deadly creatures lurk in the shadows, waiting to attack in the dark, and the planet is rapidly plunging into the utter blackness of a total eclipse. With the body count rising, the doomed survivors are forced to turn to Riddick with his eerie eyes to guide them through the darkness to safety. With time running out, there's only one rule: Stay in the light."
Pitch Perfect,2012,PG-13,1h 52min,Comedy; Music; Romance; ,5 October 2012 (USA),7.2,"College student Beca knows she does not want to be part of a clique, but that's exactly where she finds herself after arriving at her new school. Thrust in among mean gals, nice gals and just plain weird gals, Beca finds that the only thing they have in common is how well they sing together. She takes the women of the group out of their comfort zone of traditional arrangements and into a world of amazing harmonic combinations in a fight to the top of college music competitions."
