name,year,movie_rated,run_length,genres,release_date,rating,description
Eternal Sunshine of the Spotless Mind,2004,R,1h 48min,Drama; Romance; Sci-Fi; ,19 March 2004 (USA),8.3,"Joel Barish, heartbroken that his girlfriend underwent a procedure to erase him from her memory, decides to do the same. However, as he watches his memories of her fade away, he realises that he still loves her, and may be too late to correct his mistake."
Eurovision Song Contest: The Story of Fire Saga,2020,PG-13,2h 3min,Comedy; Music; ,26 June 2020 (USA),6.6,"Two small-town singers chase their pop star dreams at a global music competition, where high stakes, scheming rivals and onstage mishaps test their bond."
Event Horizon,1997,R,1h 36min,Horror; Sci-Fi; Thriller; ,15 August 1997 (USA),6.7,"In 2047, a group of astronauts are sent to investigate and salvage the starship Event Horizon which disappeared mysteriously seven years before on its maiden voyage. However, it soon becomes evident that something sinister resides in its corridors."
Everest,2015,PG-13,2h 1min,Action; Adventure; Biography; ,25 September 2015 (USA),7.1,"Inspired by the incredible events surrounding a treacherous attempt to reach the summit of the world's highest mountain, ""Everest"" documents the awe-inspiring journey of two different expeditions challenged beyond their limits by one of the fiercest snowstorms ever encountered by mankind. Their mettle tested by the harshest of elements found on the planet, the climbers will face nearly impossible obstacles as a lifelong obsession becomes a breathtaking struggle for survival."
Evil Dead,2013,R,1h 31min,Fantasy; Horror; Thriller; ,5 April 2013 (USA),6.5,"Mia, a drug addict, is determined to kick the habit. To that end, she asks her brother, David, his girlfriend, Natalie and their friends Olivia and Eric to accompany her to their family's remote forest cabin to help her through withdrawal. Eric finds a mysterious Book of the Dead at the cabin and reads aloud from it, awakening an ancient demon. All hell breaks loose when the malevolent entity possesses Mia."
Evil Dead II,1987,R,1h 24min,Comedy; Horror; ,13 March 1987 (USA),7.8,"Ash Williams and his girlfriend Linda find a log cabin in the woods with a voice recording from an archeologist who had recorded himself reciting ancient chants from ""The Book of the Dead."" As they play the recording an evil power is unleashed taking over Linda's body."
Ex Machina,2014,R,1h 48min,Drama; Mystery; Sci-Fi; ,24 April 2015 (USA),7.7,"Caleb, a coder at the world's largest internet company, wins a competition to spend a week at a private mountain retreat belonging to Nathan, the reclusive CEO of the company. But when Caleb arrives at the remote location he finds that he will have to participate in a strange and fascinating experiment in which he must interact with the world's first true artificial intelligence, housed in the body of a beautiful robot girl."
Eyes Wide Shut,1999,R,2h 39min,Drama; Mystery; Thriller; ,16 July 1999 (USA),7.4,"After Dr. Bill Harford's wife, Alice, admits to having sexual fantasies about a man she met, Bill becomes obsessed with having a sexual encounter. He discovers an underground sexual group and attends one of their meetings -- and quickly discovers that he is in over his head."
Fantastic 4: Rise of the Silver Surfer,2007,PG,1h 32min,Action; Adventure; Fantasy; ,15 June 2007 (USA),5.6,"The Fantastic Four return to the big screen as a new and all powerful enemy threatens the Earth. The seemingly unstoppable 'Silver Surfer', but all is not what it seems and there are old and new enemies that pose a greater threat than the intrepid superheroes realize."
Fantastic Beasts and Where to Find Them,2016,PG-13,2h 12min,Adventure; Fantasy; ,18 November 2016 (USA),7.3,"In 1926, Newt Scamander arrives at the Magical Congress of the United States of America with a magically expanded briefcase, which houses a number of dangerous creatures and their habitats. When the creatures escape from the briefcase, it sends the American wizarding authorities after Newt, and threatens to strain even further the state of magical and non-magical relations."
Fantastic Four,2005,PG-13,1h 46min,Action; Adventure; Fantasy; ,8 July 2005 (USA),5.7,"During a space voyage, four scientists are altered by cosmic rays: Reed Richards gains the ability to stretch his body; Sue Storm can become invisible; Johnny Storm controls fire; and Ben Grimm is turned into a super-strong … thing. Together, these ""Fantastic Four"" must now thwart the evil plans of Dr. Doom and save the world from certain destruction."
Fantastic Mr. Fox,2009,PG,1h 27min,Animation; Adventure; Comedy; ,25 November 2009 (USA),7.9,"The Fantastic Mr. Fox, bored with his current life, plans a heist against the three local farmers. The farmers, tired of sharing their chickens with the sly fox, seek revenge against him and his family."
Fargo,1996,R,1h 38min,Crime; Drama; Thriller; ,5 April 1996 (USA),8.1,"Jerry, a small-town Minnesota car salesman is bursting at the seams with debt... but he's got a plan. He's going to hire two thugs to kidnap his wife in a scheme to collect a hefty ransom from his wealthy father-in-law. It's going to be a snap and nobody's going to get hurt... until people start dying. Enter Police Chief Marge, a coffee-drinking, parka-wearing - and extremely pregnant - investigator who'll stop at nothing to get her man. And if you think her small-time investigative skills will give the crooks a run for their ransom... you betcha!"
Fast & Furious 6,2013,PG-13,2h 10min,Action; Adventure; Thriller; ,24 May 2013 (USA),7.1,"Former cop Brian O'Conner partners with ex-con Dom Toretto on the opposite side of the law. Since Brian and Mia Toretto broke Dom out of custody, they've blown across many borders to elude authorities. Now backed into a corner in Rio de Janeiro, they must pull one last job in order to gain their freedom."
Fast Five,2011,PG-13,2h 10min,Action; Adventure; Crime; ,29 April 2011 (USA),7.3,"Former cop Brian O'Conner partners with ex-con Dom Toretto on the opposite side of the law. Since Brian and Mia Toretto broke Dom out of custody, they've blown across many borders to elude authorities. Now backed into a corner in Rio de Janeiro, they must pull one last job in order to gain their freedom."
Fifty Shades of Grey,2015,R,2h 5min,Romance; ,13 February 2015 (USA),4.1,"When college senior Anastasia Steele steps in for her sick roommate to interview prominent businessman Christian Grey for their campus paper, little does she realize the path her life will take. Christian, as enigmatic as he is rich and powerful, finds himself strangely drawn to Ana, and she to him. Though sexually inexperienced, Ana plunges headlong into an affair -- and learns that Christian's true sexual proclivities push the boundaries of pain and pleasure."
Fight Club,1999,R,2h 19min,Drama; ,15 October 1999 (USA),8.8,"A ticking-time-bomb insomniac and a slippery soap salesman channel primal male aggression into a shocking new form of therapy. Their concept catches on, with underground ""fight clubs"" forming in every town, until an eccentric gets in the way and ignites an out-of-control spiral toward oblivion."
Final Destination,2000,R,1h 38min,Horror; Thriller; ,17 March 2000 (USA),6.7,"After a teenager has a terrifying vision of him and his friends dying in a plane crash, he prevents the accident only to have Death hunt them down, one by one."
Final Destination 2,2003,R,1h 30min,Horror; Thriller; ,31 January 2003 (USA),6.2,"When Kimberly has a violent premonition of a highway pileup she blocks the freeway, keeping a few others meant to die, safe...Or are they? The survivors mysteriously start dying and it's up to Kimberly to stop it before she's next."
Finding Dory,2016,PG,1h 37min,Animation; Adventure; Comedy; ,17 June 2016 (USA),7.3,Dory is reunited with her friends Nemo and Marlin in the search for answers about her past. What can she remember? Who are her parents? And where did she learn to speak Whale?
Finding Nemo,2003,G,1h 40min,Animation; Adventure; Comedy; ,30 May 2003 (USA),8.1,"Nemo, an adventurous young clownfish, is unexpectedly taken from his Great Barrier Reef home to a dentist's office aquarium. It's up to his worrisome father Marlin and a friendly but forgetful fish Dory to bring Nemo home -- meeting vegetarian sharks, surfer dude turtles, hypnotic jellyfish, hungry seagulls, and more along the way."
Finding Neverland,2004,PG,1h 46min,Biography; Drama; ,17 December 2004 (USA),7.7,"During a writing slump, playwright J.M. Barrie meets a widow and her four children, all young boys—who soon become an important part of Barrie’s life and the inspiration that lead him to create his masterpiece. Peter Pan."
First Man,2018,PG-13,2h 21min,Biography; Drama; History; ,12 October 2018 (USA),7.3,"A look at the life of the astronaut, Neil Armstrong, and the legendary space mission that led him to become the first man to walk on the Moon on July 20, 1969."
Flashdance,1983,R,1h 35min,Drama; Music; Romance; ,15 April 1983 (USA),6.2,"Alex Owens, a young woman juggling between two odd jobs, aspires to become a successful ballet dancer. Nick, who is her boss and lover, supports and encourages her to fulfil her dream."
Flight,2012,R,2h 18min,Drama; Thriller; ,2 November 2012 (USA),7.3,"Commercial airline pilot Whip Whitaker has a problem with drugs and alcohol, though so far he's managed to complete his flights safely. His luck runs out when a disastrous mechanical malfunction sends his plane hurtling toward the ground. Whip pulls off a miraculous crash-landing that results in only six lives lost. Shaken to the core, Whip vows to get sober -- but when the crash investigation exposes his addiction, he finds himself in an even worse situation."
Footloose,1984,PG,1h 47min,Drama; Music; Romance; ,17 February 1984 (USA),6.6,"When teenager Ren and his family move from big-city Chicago to a small town in the West, he's in for a real case of culture shock after discovering he's living in a place where music and dancing are illegal."
For Love of the Game,1999,PG-13,2h 17min,Drama; Romance; Sport; ,17 September 1999 (USA),6.6,"A baseball legend almost finished with his distinguished career at the age of forty has one last chance to prove who he is, what he is capable of, and win the heart of the woman he has loved for the past four years."
Ford v Ferrari,2019,PG-13,2h 32min,Action; Biography; Drama; ,15 November 2019 (USA),8.1,"American car designer Carroll Shelby and the British-born driver Ken Miles work together to battle corporate interference, the laws of physics, and their own personal demons to build a revolutionary race car for Ford Motor Company and take on the dominating race cars of Enzo Ferrari at the 24 Hours of Le Mans in France in 1966."
Forgetting Sarah Marshall,2008,R,1h 51min,Comedy; Romance; ,18 April 2008 (USA),7.1,"When actress Sarah Marshall dumps aspiring musician Peter Bretter for rock star Aldous Snow, Peter's world comes crashing down. His best friend Brian suggests that Peter should get away from everything and to fly off to Hawaii to escape all his problems. After arriving in Hawaii and meeting the beautiful receptionist Rachel Jansen, Peter is shocked to see not only Aldous in Hawaii, but also Sarah."
Forrest Gump,1994,PG-13,2h 22min,Drama; Romance; ,6 July 1994 (USA),8.8,"A man with a low IQ has accomplished great things in his life and been present during significant historic events—in each case, far exceeding what anyone imagined he could do. But despite all he has achieved, his one true love eludes him."
Foxcatcher,2014,R,2h 14min,Biography; Drama; Sport; ,16 January 2015 (USA),7,The greatest Olympic Wrestling Champion brother team joins Team Foxcatcher led by multimillionaire sponsor John E. du Pont as they train for the 1988 games in Seoul - a union that leads to unlikely circumstances.
Frank,2014,R,1h 35min,Comedy; Drama; Music; ,5 September 2014 (USA),7,A young wannabe musician discovers he has bitten off more than he can chew when he joins an eccentric pop band led by the mysterious and enigmatic Frank.
Friday Night Lights,2004,PG-13,1h 58min,Action; Drama; Sport; ,8 October 2004 (USA),7.2,"A small, turbulent town in Texas obsesses over their high school football team to an unhealthy degree. When the star tailback, Boobie Miles, is seriously injured during the first game of the season, all hope is lost, and the town's dormant social problems begin to flare up. It is left to the inspiring abilities of new coach Gary Gaines to instill in the other team members -- and, by proxy, the town itself -- a sense of self-respect and honor."
Friends with Benefits,2011,R,1h 49min,Comedy; Romance; ,22 July 2011 (USA),6.5,Dylan is done with relationships. Jamie decides to stop buying into the Hollywood clichés of true love. When the two become friends they decide to try something new and take advantage of their mutual attraction - but without any emotional attachment.
From Dusk Till Dawn,1996,R,1h 48min,Action; Crime; Horror; ,19 January 1996 (USA),7.2,"After kidnapping a father and his two kids, the Gecko brothers head south to a seedy Mexican bar to hide out in safety, unaware of its notorious vampire clientele."
From Hell,2001,R,2h 2min,Horror; Mystery; Thriller; ,19 October 2001 (USA),6.8,Frederick Abberline is an opium-huffing inspector from Scotland Yard who falls for one of Jack the Ripper's prostitute targets in this Hughes brothers adaption of a graphic novel that posits the Ripper's true identity.
From Here to Eternity,1953,Passed,1h 58min,Drama; Romance; War; ,28 August 1953 (USA),7.6,"In 1941 Hawaii, a private is cruelly punished for not boxing on his unit's team, while his captain's wife and second in command are falling in love."
Frozen,2013,PG,1h 42min,Animation; Adventure; Comedy; ,27 November 2013 (USA),7.4,"Young princess Anna of Arendelle dreams about finding true love at her sister Elsa’s coronation. Fate takes her on a dangerous journey in an attempt to end the eternal winter that has fallen over the kingdom. She's accompanied by ice delivery man Kristoff, his reindeer Sven, and snowman Olaf. On an adventure where she will find out what friendship, courage, family, and true love really means."
Full Metal Jacket,1987,R,1h 56min,Drama; War; ,10 July 1987 (USA),8.3,A pragmatic U.S. Marine observes the dehumanizing effects the U.S.-Vietnam War has on his fellow recruits from their brutal boot camp training to the bloody street fighting in Hue.
Furious 7,2015,PG-13,2h 17min,Action; Adventure; Thriller; ,3 April 2015 (USA),7.1,Deckard Shaw seeks revenge against Dominic Toretto and his family for his comatose brother.
Fury,2014,R,2h 14min,Action; Drama; War; ,17 October 2014 (USA),7.6,"In the last months of World War II, as the Allies make their final push in the European theatre, a battle-hardened U.S. Army sergeant named 'Wardaddy' commands a Sherman tank called 'Fury' and its five-man crew on a deadly mission behind enemy lines. Outnumbered and outgunned, Wardaddy and his men face overwhelming odds in their heroic attempts to strike at the heart of Nazi Germany."
G.I. Jane,1997,R,2h 5min,Action; Drama; War; ,22 August 1997 (USA),5.9,"In response to political pressure from Senator Lillian DeHaven, the U.S. Navy begins a program that would allow for the eventual integration of women into its combat services. The program begins with a single trial candidate, Lieutenant Jordan O'Neil, who is chosen specifically for her femininity. O'Neil enters the grueling Navy SEAL training program under the command of Master Chief John James Urgayle, who unfairly pushes O'Neil until her determination wins his respect."
Gandhi,1982,PG,3h 11min,Biography; Drama; History; ,25 February 1983 (USA),8,"In the early years of the 20th century, Mohandas K. Gandhi, a British-trained lawyer, forsakes all worldly possessions to take up the cause of Indian independence. Faced with armed resistance from the British government, Gandhi adopts a policy of 'passive resistance', endeavouring to win freedom for his people without resorting to bloodshed."
Gangs of New York,2002,R,2h 47min,Crime; Drama; ,20 December 2002 (USA),7.5,"In 1863, Amsterdam Vallon returns to the Five Points of America to seek vengeance against the psychotic gangland kingpin, Bill the Butcher, who murdered his father years earlier. With an eager pickpocket by his side and a whole new army, Vallon fights his way to seek vengeance on the Butcher and restore peace in the area."
Garden State,2004,R,1h 42min,Comedy; Romance; ,20 August 2004 (USA),7.4,"Andrew returns to his hometown for the funeral of his mother, a journey that reconnects him with past friends. The trip coincides with his decision to stop taking his powerful antidepressants. A chance meeting with Sam - a girl also suffering from various maladies - opens up the possibility of rekindling emotional attachments, confronting his psychologist father, and perhaps beginning a new life."
Get Him to the Greek,2010,R,1h 49min,Comedy; Music; ,4 June 2010 (USA),6.4,"Pinnacle records has the perfect plan to get their sinking company back on track: a comeback concert in LA featuring Aldous Snow, a fading rockstar who has dropped off the radar in recent years. Record company intern Aaron Green is faced with the monumental task of bringing his idol, out of control rock star Aldous Snow, back to LA for his comeback show."
Get Out,2017,R,1h 44min,Horror; Mystery; Thriller; ,24 February 2017 (USA),7.7,"Chris and his girlfriend Rose go upstate to visit her parents for the weekend. At first, Chris reads the family's overly accommodating behavior as nervous attempts to deal with their daughter's interracial relationship, but as the weekend progresses, a series of increasingly disturbing discoveries lead him to a truth that he never could have imagined."
Gettysburg,1993,PG,4h 31min,Drama; History; War; ,8 October 1993 (USA),7.6,"In the summer of 1863, General Robert E. Lee leads the Confederate Army of Northern Virginia into Gettysburg, Pennsylvania with the goal of marching through to Washington, D.C. The Union Army of the Potomac, under the command of General George G. Meade, forms a defensive position to confront the rebel forces in what will prove to be the decisive battle of the American Civil War."
Ghost,1990,PG-13,2h 7min,Romance; ,13 July 1990 (USA),7,"After a young man is murdered, his spirit stays behind to warn his lover of impending danger, with the help of a reluctant psychic."
Ghost Rider,2007,PG-13,1h 50min,Action; Fantasy; Thriller; ,16 February 2007 (USA),5.2,"In order to save his dying father, young stunt cyclist Johnny Blaze sells his soul to Mephistopheles and sadly parts from the pure-hearted Roxanne Simpson, the love of his life. Years later, Johnny's path crosses again with Roxanne, now a go-getting reporter, and also with Mephistopheles, who offers to release Johnny's soul if Johnny becomes the fabled, fiery 'Ghost Rider'."
Ghostbusters,1984,PG,1h 45min,Comedy; ,8 June 1984 (USA),7.8,"After losing their academic posts at a prestigious university, a team of parapsychologists goes into business as proton-pack-toting ""ghostbusters"" who exterminate ghouls, hobgoblins and supernatural pests of all stripes. An ad campaign pays off when a knockout cellist hires the squad to purge her swanky digs of demons that appear to be living in her refrigerator."
"Girl, Interrupted",1999,R,2h 7min,Biography; Drama; ,14 January 2000 (USA),7.3,"Set in the changing world of the late 1960s, Susanna Kaysen's prescribed ""short rest"" from a psychiatrist she had met only once becomes a strange, unknown journey into Alice's Wonderland, where she struggles with the thin line between normal and crazy. Susanna soon realizes how hard it is to get out once she has been committed, and she ultimately has to choose between the world of people who belong inside or the difficult world of reality outside."
Gladiator,2000,R,2h 35min,Action; Adventure; Drama; ,5 May 2000 (USA),8.5,"After the death of Emperor Marcus Aurelius, his devious son takes power and demotes Maximus, one of Rome's most capable generals who Marcus preferred. Eventually, Maximus is forced to become a gladiator and battle to the death against other men for the amusement of paying audiences."
Glory,1989,R,2h 2min,Biography; Drama; History; ,16 February 1990 (USA),7.8,"Robert Gould Shaw leads the US Civil War's first all-black volunteer company, fighting prejudices of both his own Union army and the Confederates."
Glory Road,2006,PG,1h 58min,Biography; Drama; Sport; ,13 January 2006 (USA),7.2,"In 1966, Texas Western coach Don Haskins led the first all-black starting line-up for a college basketball team to the NCAA national championship."
Godzilla,2014,PG-13,2h 3min,Action; Adventure; Sci-Fi; ,16 May 2014 (USA),6.4,"Ford Brody, a Navy bomb expert, has just reunited with his family in San Francisco when he is forced to go to Japan to help his estranged father, Joe. Soon, both men are swept up in an escalating crisis when an ancient alpha predator arises from the sea to combat malevolent adversaries that threaten the survival of humanity. The creatures leave colossal destruction in their wake, as they make their way toward their final battleground: San Francisco."
Gone Baby Gone,2007,R,1h 54min,Crime; Drama; Mystery; ,19 October 2007 (USA),7.6,"When 4 year old Amanda McCready disappears from her home and the police make little headway in solving the case, the girl's aunt, Beatrice McCready hires two private detectives, Patrick Kenzie and Angie Gennaro. The detectives freely admit that they have little experience with this type of case, but the family wants them for two reasons—they're not cops and they know the tough neighborhood in which they all live."
Gone Girl,2014,R,2h 29min,Drama; Mystery; Thriller; ,3 October 2014 (USA),8.1,"With his wife's disappearance having become the focus of an intense media circus, a man sees the spotlight turned on him when it's suspected that he may not be innocent."
Gone with the Wind,1939,Passed,3h 58min,Drama; History; Romance; ,17 January 1940 (USA),8.1,The spoiled daughter of a Georgia plantation owner conducts a tumultuous romance with a cynical profiteer during the American Civil War and Reconstruction Era.
"Good Morning, Vietnam",1987,R,2h 1min,Biography; Comedy; Drama; ,15 January 1988 (USA),7.3,"A disk jockey goes to Vietnam to work for the Armed Forces Radio Service. While he becomes popular among the troops, his superiors disapprove of his humor."
"Good Night, and Good Luck.",2005,PG,1h 33min,Biography; Drama; History; ,4 November 2005 (USA),7.4,The story of journalist Edward R. Murrow's stand against Senator Joseph McCarthy's anti-communist witch-hunts in the early 1950s.
Good Will Hunting,1997,R,2h 6min,Drama; Romance; ,9 January 1998 (USA),8.3,"Headstrong yet aimless, Will Hunting has a genius-level IQ but chooses to work as a janitor at MIT. When he secretly solves highly difficult graduate-level math problems, his talents are discovered by Professor Gerald Lambeau, who decides to help the misguided youth reach his potential. When Will is arrested for attacking a police officer, Professor Lambeau makes a deal to get leniency for him if he gets court-ordered therapy. Eventually, therapist Dr. Sean Maguire helps Will confront the demons that are holding him back."
Goodfellas,1990,R,2h 26min,Biography; Crime; Drama; ,21 September 1990 (USA),8.7,"The true story of Henry Hill, a half-Irish, half-Sicilian Brooklyn kid who is adopted by neighbourhood gangsters at an early age and climbs the ranks of a Mafia family under the guidance of Jimmy Conway."
Goon,2011,R,1h 32min,Comedy; Drama; Sport; ,24 February 2012 (Canada),6.8,"Doug Glatt, a slacker who discovers he has a talent for brawling, is approached by a minor league hockey coach and invited to join the team as the ""muscle."" Despite the fact that Glatt can't skate, his best friend, Pat, convinces him to give it a shot, and Glatt becomes a hero to the team and their fans, until the league's reigning goon becomes threatened by Glatt's success and decides to even the score."
Gran Torino,2008,R,1h 56min,Drama; ,9 January 2009 (USA),8.1,"Disgruntled Korean War veteran Walt Kowalski sets out to reform his neighbor, Thao Lor, a Hmong teenager who tried to steal Kowalski's prized possession: a 1972 Gran Torino."
Grave of the Fireflies,1988,Not Rated,1h 29min,Animation; Drama; War; ,26 July 1989 (USA),8.5,"In the final months of World War II, 14-year-old Seita and his sister Setsuko are orphaned when their mother is killed during an air raid in Kobe, Japan. After a falling out with their aunt, they move into an abandoned bomb shelter. With no surviving relatives and their emergency rations depleted, Seita and Setsuko struggle to survive."
Gravity,2013,PG-13,1h 31min,Drama; Sci-Fi; Thriller; ,4 October 2013 (USA),7.7,"Dr. Ryan Stone, a brilliant medical engineer on her first Shuttle mission, with veteran astronaut Matt Kowalsky in command of his last flight before retiring. But on a seemingly routine spacewalk, disaster strikes. The Shuttle is destroyed, leaving Stone and Kowalsky completely alone-tethered to nothing but each other and spiraling out into the blackness of space. The deafening silence tells them they have lost any link to Earth and any chance for rescue. As fear turns to panic, every gulp of air eats away at what little oxygen is left. But the only way home may be to go further out into the terrifying expanse of space."
Grease,1978,PG,1h 50min,Romance; ,16 June 1978 (USA),7.2,"Australian good girl Sandy and greaser Danny fell in love over the summer. But when they unexpectedly discover they're now in the same high school, will they be able to rekindle their romance despite their eccentric friends?"
