name,year,movie_rated,run_length,genres,release_date,rating,description
The Color of Money,1986,R,1h 59min,Drama; Sport; ,17 October 1986 (USA),7,"Former pool hustler ""Fast Eddie"" Felson decides he wants to return to the game by taking a pupil. He meets talented but green Vincent Lauria and proposes a partnership. As they tour pool halls, Eddie teaches Vincent the tricks of scamming, but he eventually grows frustrated with Vincent's showboat antics, leading to an argument and a falling-out. Eddie takes up playing again and soon crosses paths with Vincent as an opponent."
The Commitments,1991,R,1h 58min,Comedy; Drama; Music; ,13 September 1991 (USA),7.6,"Jimmy Rabbitte, just a thick-ya out of school, gets a brilliant idea: to put a soul band together in Barrytown, his slum home in north Dublin. First he needs musicians and singers: things slowly start to click when he finds three fine-voiced females virtually in his back yard, a lead singer (Deco) at a wedding, and, responding to his ad, an aging trumpet player, Joey ""The Lips"" Fagan."
The Conjuring,2013,R,1h 52min,Horror; Mystery; Thriller; ,19 July 2013 (USA),7.5,"Paranormal investigators Ed and Lorraine Warren work to help a family terrorized by a dark presence in their farmhouse. Forced to confront a powerful entity, the Warrens find themselves caught in the most terrifying case of their lives."
The Conjuring 2,2016,R,2h 14min,Horror; Mystery; Thriller; ,10 June 2016 (USA),7.3,Lorraine and Ed Warren travel to north London to help a single mother raising four children alone in a house plagued by malicious spirits.
The Croods,2013,PG,1h 38min,Animation; Action; Adventure; ,22 March 2013 (USA),7.2,"The prehistoric Croods family live in a particularly dangerous moment in time. Patriarch Grug, his mate Ugga, teenage daughter Eep, son Thunk, and feisty Gran gather food by day and huddle together in a cave at night. When a more evolved caveman named Guy arrives on the scene, Grug is distrustful, but it soon becomes apparent that Guy is correct about the impending destruction of their world."
The Curious Case of Benjamin Button,2008,PG-13,2h 46min,Drama; Fantasy; Romance; ,25 December 2008 (USA),7.8,"Born under unusual circumstances, Benjamin Button springs into being as an elderly man in a New Orleans nursing home and ages in reverse. Twelve years after his birth, he meets Daisy, a child who flits in and out of his life as she grows up to be a dancer. Though he has all sorts of unusual adventures over the course of his life, it is his relationship with Daisy, and the hope that they will come together at the right time, that drives Benjamin forward."
The Da Vinci Code,2006,PG-13,2h 29min,Mystery; Thriller; ,19 May 2006 (USA),6.6,"A murder in Paris’ Louvre Museum and cryptic clues in some of Leonardo da Vinci’s most famous paintings lead to the discovery of a religious mystery. For 2,000 years a secret society closely guards information that — should it come to light — could rock the very foundations of Christianity."
The Danish Girl,2015,R,1h 59min,Biography; Drama; Romance; ,22 January 2016 (USA),7.1,"When Gerda Wegener asks her husband Einar to fill in as a portrait model, Einar discovers the person she's meant to be and begins living her life as Lili Elbe. Having realized her true self and with Gerda's love and support, Lili embarks on a groundbreaking journey as a transgender pioneer."
The Dark Knight,2008,PG-13,2h 32min,Action; Crime; Drama; ,18 July 2008 (USA),9,"Batman raises the stakes in his war on crime. With the help of Lt. Jim Gordon and District Attorney Harvey Dent, Batman sets out to dismantle the remaining criminal organizations that plague the streets. The partnership proves to be effective, but they soon find themselves prey to a reign of chaos unleashed by a rising criminal mastermind known to the terrified citizens of Gotham as the Joker."
The Dark Knight Rises,2012,PG-13,2h 44min,Action; Adventure; ,20 July 2012 (USA),8.4,"Following the death of District Attorney Harvey Dent, Batman assumes responsibility for Dent's crimes to protect the late attorney's reputation and is subsequently hunted by the Gotham City Police Department. Eight years later, Batman encounters the mysterious Selina Kyle and the villainous Bane, a new terrorist leader who overwhelms Gotham's finest. The Dark Knight resurfaces to protect a city that has branded him an enemy."
The Day After Tomorrow,2004,PG-13,2h 4min,Action; Adventure; Sci-Fi; ,28 May 2004 (USA),6.4,"After paleoclimatologist Jack Hall is largely ignored by UN officials when presenting his environmental concerns about the beginning of a new Ice Age, his research proves true when a superstorm develops, setting off catastrophic natural disasters throughout the world. Trying to get to his son, Sam, who is trapped in New York City with his friend Laura and others, Jack and his crew must travel to get to Sam before it's too late."
The Death of Stalin,2017,R,1h 47min,Comedy; Drama; History; ,9 March 2018 (USA),7.2,"When dictator Joseph Stalin dies, his parasitic cronies square off in a frantic power struggle to become the next Soviet leader. As they bumble, brawl and back-stab their way to the top, the question remains — just who is running the government?"
The Deer Hunter,1978,R,3h 3min,Drama; War; ,23 February 1979 (USA),8.1,"A group of working-class friends decide to enlist in the Army during the Vietnam War and finds it to be hellish chaos -- not the noble venture they imagined. Before they left, Steven married his pregnant girlfriend -- and Michael and Nick were in love with the same woman. But all three are different men upon their return."
The Departed,2006,R,2h 31min,Crime; Drama; Thriller; ,6 October 2006 (USA),8.5,"To take down South Boston's Irish Mafia, the police send in one of their own to infiltrate the underworld, not realizing the syndicate has done likewise. While an undercover cop curries favor with the mob kingpin, a career criminal rises through the police ranks. But both sides soon discover there's a mole among them."
The Descent,2005,R,1h 39min,Adventure; Horror; Thriller; ,4 August 2006 (USA),7.2,"After a tragic accident, six friends reunite for a caving expedition. Their adventure soon goes horribly wrong when a collapse traps them deep underground and they find themselves pursued by bloodthirsty creatures. As their friendships deteriorate, they find themselves in a desperate struggle to survive the creatures and each other."
The Devil Wears Prada,2006,PG-13,1h 49min,Comedy; ,30 June 2006 (USA),6.9,"Andy moves to New York to work in the fashion industry. Her boss is extremely demanding, cruel and won't let her succeed if she doesn't fit into the high class elegant look of their magazine."
The Devil's Advocate,1997,R,2h 24min,Drama; Mystery; Thriller; ,17 October 1997 (USA),7.5,"Aspiring Florida defense lawyer Kevin Lomax accepts a job at a New York law firm. With the stakes getting higher every case, Kevin quickly learns that his boss has something far more evil planned."
The Dirty Dozen,1967,Not Rated,2h 30min,Action; Adventure; War; ,22 October 1967 (UK),7.7,"12 American military prisoners in World War II are ordered to infiltrate a well-guarded enemy château and kill the Nazi officers vacationing there. The soldiers, most of whom are facing death sentences for a variety of violent crimes, agree to the mission and the possible commuting of their sentences."
The Disaster Artist,2017,R,1h 44min,Biography; Comedy; Drama; ,8 December 2017 (USA),7.4,"An aspiring actor in Hollywood meets an enigmatic stranger by the name of Tommy Wiseau, the meeting leads the actor down a path nobody could have predicted; creating the worst movie ever made."
The Doors,1991,R,2h 20min,Biography; Drama; Music; ,1 March 1991 (USA),7.2,"The story of the famous and influential 1960s rock band and its lead singer and composer, Jim Morrison."
The Double Life of Véronique,1991,R,1h 38min,Drama; Fantasy; Music; ,22 November 1991 (USA),7.8,"Véronique is a beautiful young French woman who aspires to be a renowned singer; Weronika lives in Poland, has a similar career goal and looks identical to Véronique, though the two are not related. The film follows both women as they contend with the ups and downs of their individual lives, with Véronique embarking on an unusual romance with Alexandre Fabbri, a puppeteer who may be able to help her with her existential issues."
The Duchess,2008,PG-13,1h 50min,Biography; Drama; History; ,10 October 2008 (USA),6.9,"A chronicle of the life of 18th century aristocrat Georgiana, Duchess of Devonshire, who was reviled for her extravagant political and personal life."
The Elephant Man,1980,PG,2h 4min,Biography; Drama; ,10 October 1980 (USA),8.1,"A Victorian surgeon rescues a heavily disfigured man being mistreated by his ""owner"" as a side-show freak. Behind his monstrous façade, there is revealed a person of great intelligence and sensitivity. Based on the true story of Joseph Merrick (called John Merrick in the film), a severely deformed man in 19th century London."
The Emperor's New Groove,2000,G,1h 18min,Animation; Adventure; Comedy; ,15 December 2000 (USA),7.3,"When self-centered Emperor Kuzco is turned into a llama by his scheming advisor, he is forced to rely on good-hearted peasant Pacha to get back home."
The English Patient,1996,R,2h 42min,Drama; Romance; War; ,6 December 1996 (USA),7.4,"In the 1930s, Count Almásy is a Hungarian map maker employed by the Royal Geographical Society to chart the vast expanses of the Sahara Desert along with several other prominent explorers. As World War II unfolds, Almásy enters into a world of love, betrayal, and politics."
The Equalizer,2014,R,2h 12min,Action; Crime; Thriller; ,26 September 2014 (USA),7.2,"McCall believes he has put his mysterious past behind him and dedicated himself to beginning a new, quiet life. But when he meets Teri, a young girl under the control of ultra-violent Russian gangsters, he can’t stand idly by – he has to help her. Armed with hidden skills that allow him to serve vengeance against anyone who would brutalize the helpless, McCall comes out of his self-imposed retirement and finds his desire for justice reawakened. If someone has a problem, if the odds are stacked against them, if they have nowhere else to turn, McCall will help. He is The Equalizer."
The Evil Dead,1981,NC-17,1h 25min,Horror; ,15 April 1983 (USA),7.5,"In 1979, a group of college students find a Sumerian Book of the Dead in an old wilderness cabin they've rented for a weekend getaway."
The Exorcist,1973,R,2h 2min,Horror; ,26 December 1973 (USA),8,"When a charming 12-year-old girl takes on the characteristics and voices of others, doctors say there is nothing they can do. As people begin to die, the girl's mother realizes her daughter has been possessed by the devil - and that her daughter's only possible hope lies with two priests and the ancient rite of demonic exorcism."
The Expendables,2010,R,1h 43min,Action; Adventure; Thriller; ,13 August 2010 (USA),6.5,"Barney Ross leads a band of highly skilled mercenaries including knife enthusiast Lee Christmas, a martial arts expert Yin Yang, heavy weapons specialist Hale Caesar, demolitionist Toll Road, and a loose-cannon sniper Gunner Jensen. When the group is commissioned by the mysterious Mr. Church to assassinate the dictator of a small South American island, Barney and Lee visit the remote locale to scout out their opposition and discover the true nature of the conflict engulfing the city."
The Expendables 2,2012,R,1h 43min,Action; Adventure; Thriller; ,17 August 2012 (USA),6.6,"Mr. Church reunites the Expendables for what should be an easy paycheck, but when one of their men is murdered on the job, their quest for revenge puts them deep in enemy territory and up against an unexpected threat."
The Fan,1996,R,1h 56min,Action; Drama; Sport; ,16 August 1996 (USA),5.9,"When the San Francisco Giants pay center-fielder, Bobby Rayburn $40 million to lead their team to the World Series, no one is happier or more supportive than #1 fan, Gil Renard.  When Rayburn becomes mired in the worst slump of his career, the obsessed Renard decides to stop at nothing to help his idol regain his former glory—not even murder."
The Fast and the Furious,2001,PG-13,1h 46min,Action; Crime; Thriller; ,22 June 2001 (USA),6.8,"Dominic Toretto is a Los Angeles street racer suspected of masterminding a series of big-rig hijackings. When undercover cop Brian O'Conner infiltrates Toretto's iconoclastic crew, he falls for Toretto's sister and must choose a side: the gang or the LAPD."
The Fault in Our Stars,2014,PG-13,2h 6min,Romance; ,6 June 2014 (USA),7.7,"Despite the tumor-shrinking medical miracle that has bought her a few years, Hazel has never been anything but terminal, her final chapter inscribed upon diagnosis. But when a patient named Augustus Waters suddenly appears at Cancer Kid Support Group, Hazel's story is about to be completely rewritten."
The Favourite,2018,R,1h 59min,Biography; Comedy; Drama; ,21 December 2018 (USA),7.5,"England, early 18th century. The close relationship between Queen Anne and Sarah Churchill is threatened by the arrival of Sarah's cousin, Abigail Hill, resulting in a bitter rivalry between the two cousins to be the Queen's favourite."
The Fifth Element,1997,PG-13,2h 6min,Action; Adventure; Sci-Fi; ,9 May 1997 (USA),7.7,"In 2257, a taxi driver is unintentionally given the task of saving a young girl who is part of the key that will ensure the survival of humanity."
The Fighter,2010,R,1h 56min,Biography; Drama; Sport; ,17 December 2010 (USA),7.8,"Boxer ""Irish"" Micky Ward's unlikely road to the world light welterweight title. His Rocky-like rise was shepherded by half-brother Dicky, a boxer-turned-trainer who rebounded in life after nearly being KO'd by drugs and crime."
The Finest Hours,2016,PG-13,1h 57min,Action; Drama; History; ,29 January 2016 (USA),6.8,The Coast Guard makes a daring rescue attempt off the coast of Cape Cod after a pair of oil tankers are destroyed during a blizzard in 1952.
The Flowers of War,2011,R,2h 26min,Drama; History; Romance; ,16 December 2011 (China),7.6,"A Westerner finds refuge with a group of women in a church during Japan's rape of Nanking in 1937. Posing as a priest, he attempts to lead the women to safety."
The Fly,1986,R,1h 36min,Drama; Horror; Sci-Fi; ,15 August 1986 (USA),7.6,"When Seth Brundle makes a huge scientific and technological breakthrough in teleportation, he decides to test it on himself. Unbeknownst to him, a common housefly manages to get inside the device and the two become one."
The Football Factory,2004,R,1h 31min,Crime; Drama; Sport; ,14 May 2004 (UK),6.8,"The Football Factory is more than just a study of the English obsession with football violence, it's about men looking for armies to join, wars to fight and places to belong. A forgotten culture of Anglo Saxon males fed up with being told they're not good enough and using their fists as a drug they describe as being more potent than sex and drugs put together."
The Fountain,2006,PG-13,1h 37min,Drama; Mystery; Romance; ,22 November 2006 (USA),7.2,"Spanning over one thousand years, and three parallel stories, The Fountain is a story of love, death, spirituality, and the fragility of our existence in this world."
The Game,1997,R,2h 9min,Drama; Mystery; Thriller; ,12 September 1997 (USA),7.8,"In honor of his birthday, San Francisco banker Nicholas Van Orton, a financial genius and a cold-hearted loner, receives an unusual present from his younger brother, Conrad: a gift certificate to play a unique kind of game. In nary a nanosecond, Nicholas finds himself consumed by a dangerous set of ever-changing rules, unable to distinguish where the charade ends and reality begins."
The Girl Next Door,2004,R,1h 49min,Comedy; Romance; ,9 April 2004 (USA),6.7,"Exceptionally ambitious high schooler Matthew has aspirations for a career in politics when he falls in love with his gorgeous 19-year-old neighbor, Danielle. But Matthew's bright future is jeopardized when he finds Danielle was once a porn star. As Danielle's past catches up with her, Matthew's love for her forces him to re-evaluate his goals."
The Girl with the Dragon Tattoo,2011,R,2h 38min,Crime; Drama; Mystery; ,21 December 2011 (USA),7.8,"Disgraced journalist Mikael Blomkvist investigates the disappearance of a weary patriarch's niece from 40 years ago. He is aided by the pierced, tattooed, punk computer hacker named Lisbeth Salander. As they work together in the investigation, Blomkvist and Salander uncover immense corruption beyond anything they have ever imagined."
The Godfather,1972,R,2h 55min,Crime; Drama; ,24 March 1972 (USA),9.2,"Spanning the years 1945 to 1955, a chronicle of the fictional Italian-American Corleone crime family. When organized crime family patriarch, Vito Corleone barely survives an attempt on his life, his youngest son, Michael steps in to take care of the would-be killers, launching a campaign of bloody revenge."
The Godfather: Part II,1974,R,3h 22min,Crime; Drama; ,18 December 1974 (USA),9,"In the continuing saga of the Corleone crime family, a young Vito Corleone grows up in Sicily and in 1910s New York. In the 1950s, Michael Corleone attempts to expand the family business into Las Vegas, Hollywood and Cuba."
The Godfather: Part III,1990,R,2h 42min,Crime; Drama; ,25 December 1990 (USA),7.6,"In the midst of trying to legitimize his business dealings in 1979 New York and Italy, aging mafia don, Michael Corleone seeks forgiveness for his sins while taking a young protege under his wing."
The Good Shepherd,2006,R,2h 47min,Drama; History; Thriller; ,22 December 2006 (USA),6.7,"Edward Wilson, the only witness to his father's suicide and member of the Skull and Bones Society while a student at Yale, is a morally upright young man who values honor and discretion, qualities that help him to be recruited for a career in the newly founded OSS. His dedication to his work does not come without a price though, leading him to sacrifice his ideals and eventually his family."
The Graduate,1967,PG,1h 46min,Comedy; Romance; ,21 December 1967 (USA),8,"Benjamin, a recent college graduate very worried about his future, finds himself in a love triangle with an older woman and her daughter."
The Grand Budapest Hotel,2014,R,1h 39min,Adventure; Comedy; Crime; ,28 March 2014 (USA),8.1,"The Grand Budapest Hotel tells of a legendary concierge at a famous European hotel between the wars and his friendship with a young employee who becomes his trusted protégé. The story involves the theft and recovery of a priceless Renaissance painting, the battle for an enormous family fortune and the slow and then sudden upheavals that transformed Europe during the first half of the 20th century."
The Grapes of Wrath,1940,Passed,2h 9min,Drama; History; ,15 March 1940 (USA),8,"Tom Joad returns to his home after a jail sentence to find his family kicked out of their farm due to foreclosure. He catches up with them on his Uncle’s farm, and joins them the next day as they head for California and a new life... Hopefully."
The Great Dictator,1940,Passed,2h 5min,Comedy; Drama; War; ,7 March 1941 (USA),8.4,Dictator Adenoid Hynkel tries to expand his empire while a poor Jewish barber tries to avoid persecution from Hynkel's regime.
The Great Escape,1963,Not Rated,2h 52min,Adventure; Drama; History; ,4 July 1963 (USA),8.2,"The Nazis, exasperated at the number of escapes from their prison camps by a relatively small number of Allied prisoners, relocate them to a high-security 'escape-proof' camp to sit out the remainder of the war. Undaunted, the prisoners plan one of the most ambitious escape attempts of World War II. Based on a true story."
The Great Gatsby,2013,PG-13,2h 23min,Romance; ,10 May 2013 (USA),7.2,"An adaptation of F. Scott Fitzgerald's Long Island-set novel, where Midwesterner Nick Carraway is lured into the lavish world of his neighbor, Jay Gatsby. Soon enough, however, Carraway will see through the cracks of Gatsby's nouveau riche existence, where obsession, madness, and tragedy await."
The Great Raid,2005,R,2h 12min,Action; Drama; War; ,12 August 2005 (USA),6.7,"As World War II rages, the elite Sixth Ranger Battalion is given a mission of heroic proportions: push 30 miles behind enemy lines and liberate over 500 American prisoners of war."
The Greatest Game Ever Played,2005,PG,2h,Biography; Drama; Sport; ,30 September 2005 (USA),7.4,"A biopic of 20-year-old Francis Ouimet who defeated his golfing idol and 1900 US Open Champion, Harry Vardon."
The Greatest Showman,2017,PG,1h 45min,Biography; Drama; ,20 December 2017 (USA),7.6,"The story of American showman P.T. Barnum, founder of the circus that became the famous traveling Ringling Bros. and Barnum & Bailey Circus."
The Green Mile,1999,R,3h 9min,Crime; Drama; Fantasy; ,10 December 1999 (USA),8.6,"A supernatural tale set on death row in a Southern prison, where gentle giant John Coffey possesses the mysterious power to heal people's ailments. When the cell block's head guard, Paul Edgecomb, recognizes Coffey's miraculous gift, he tries desperately to help stave off the condemned man's execution."
The Guernsey Literary and Potato Peel Pie Society,2018,TV-14,2h 4min,Drama; Romance; War; ,10 August 2018 (USA),7.4,"Free-spirited writer Juliet Ashton forms a life-changing bond with the delightful and eccentric Guernsey Literary and Potato Peel Pie Society, when she decides to write about the book club they formed during the occupation of Guernsey in WWII."
The Hangover,2009,R,1h 40min,Comedy; ,5 June 2009 (USA),7.7,"When three friends finally come to after a raucous night of bachelor-party revelry, they find a baby in the closet and a tiger in the bathroom. But they can't seem to locate their best friend, Doug – who's supposed to be tying the knot. Launching a frantic search for Doug, the trio perseveres through a nasty hangover to try to make it to the church on time."
The Hangover Part II,2011,R,1h 42min,Comedy; ,26 May 2011 (USA),6.4,"The Hangover crew heads to Thailand for Stu's wedding. After the disaster of a bachelor party in Las Vegas last year, Stu is playing it safe with a mellow pre-wedding brunch. However, nothing goes as planned and Bangkok is the perfect setting for another adventure with the rowdy group."
The Hangover Part III,2013,R,1h 40min,Comedy; Crime; ,23 May 2013 (USA),5.8,"This time, there's no wedding. No bachelor party. What could go wrong, right? But when the Wolfpack hits the road, all bets are off."
The Happening,2008,R,1h 31min,Drama; Mystery; Sci-Fi; ,13 June 2008 (USA),5,"When a deadly airborne virus threatens to wipe out the northeastern United States, teacher Elliot Moore and his wife Alma flee from contaminated cities into the countryside in a fight to discover the truth. Is it terrorism, the accidental release of some toxic military bio weapon -- or something even more sinister?"
The Hateful Eight,2015,R,2h 48min,Crime; Drama; Mystery; ,30 December 2015 (USA),7.8,Bounty hunters seek shelter from a raging blizzard and get caught up in a plot of betrayal and deception.
The Hills Have Eyes,2006,R,1h 47min,Horror; Thriller; ,10 March 2006 (USA),6.4,"Based on Wes Craven's 1977 suspenseful cult classic, The Hills Have Eyes is the story of a family road trip that goes terrifyingly awry when the travelers become stranded in a government atomic zone. Miles from nowhere, the Carter family soon realizes the seemingly uninhabited wasteland is actually the breeding ground of a blood-thirsty mutant family...and they are the prey."
The Hobbit: An Unexpected Journey,2012,PG-13,2h 49min,Adventure; Fantasy; ,14 December 2012 (USA),7.8,"Bilbo Baggins, a hobbit enjoying his quiet life, is swept into an epic quest by Gandalf the Grey and thirteen dwarves who seek to reclaim their mountain home from Smaug, the dragon."
The Hobbit: The Battle of the Five Armies,2014,PG-13,2h 24min,Adventure; Fantasy; ,17 December 2014 (USA),7.4,"Immediately after the events of The Desolation of Smaug, Bilbo and the dwarves try to defend Erebor's mountain of treasure from others who claim it: the men of the ruined Laketown and the elves of Mirkwood. Meanwhile an army of Orcs led by Azog the Defiler is marching on Erebor, fueled by the rise of the dark lord Sauron. Dwarves, elves and men must unite, and the hope for Middle-Earth falls into Bilbo's hands."
The Hobbit: The Desolation of Smaug,2013,PG-13,2h 41min,Adventure; Fantasy; ,13 December 2013 (USA),7.8,"The Dwarves, Bilbo and Gandalf have successfully escaped the Misty Mountains, and Bilbo has gained the One Ring. They all continue their journey to get their gold back from the Dragon, Smaug."
The Holiday,2006,PG-13,2h 16min,Comedy; Romance; ,8 December 2006 (USA),6.9,"Two women, one from the United States and one from the United Kingdom, swap homes at Christmas time after bad breakups with their boyfriends. Each woman finds romance with a local man but realizes that the imminent return home may end the relationship."
